<?xml version="1.0" encoding="utf-8" standalone="yes"?>
<!-- Sample XML generated by QTAssistant (http://www.paschidev.com) -->
<oa:accounts xmlns:xsi="http://www.w3.org/2001/XMLSchema-instance"
xmlns:oa="http://organize-your-accounts.com"
xsi:schemaLocation="http://organize-your-accounts.com accounts2.xsd"
>
     <oa:Account>
        <oa:Title>Title1</oa:Title>
        <oa:FirstName>FirstName1</oa:FirstName>
        <oa:LastName>LastName1</oa:LastName>
        <oa:Dateborn>1900-01-01</oa:Dateborn>
        <oa:Gender>Gender1</oa:Gender>
        <oa:AccountID>AccountID1</oa:AccountID>
        <oa:PasswordID>PasswordID2</oa:PasswordID>
    </oa:Account>
    <oa:Account>
        <oa:Title>Title1</oa:Title>
        <oa:FirstName>FirstName1</oa:FirstName>
        <oa:LastName>LastName1</oa:LastName>
        <oa:Dateborn>1900-01-01</oa:Dateborn>
        <oa:Gender>Gender1</oa:Gender>
        <oa:AccountID>AccountID2</oa:AccountID>
        <oa:PasswordID>PasswordID1</oa:PasswordID>
    </oa:Account>
    <oa:Password patt="pwd1">
        <oa:firstname></oa:firstname>
     </oa:Password>
</oa:accounts>